T PL,H PL,verb,verb - main semantic class,verb - tense,verb - factive/nonfactive,complement - tense,T - negation,T - type of sentence,"GOLD <T,H>"
"Wszystkie tablice elbląskie zostały skasowane, a dopiero 7 stycznia dowiedzieliśmy się, że nadal możemy je wydawać.",nadal możemy je wydawać.,"dowiedzieć się, że_",epistemiczny,past,F,present,False,indywidualne,E
" Pomyślałam, że powinna pani wiedzieć z czego zrezygnował, albo od czego uciekł... ","powinna pani wiedzieć z czego zrezygnował, albo od czego uciekł... ","pomyśleć, że_",epistemiczny,past,NF,inne,False,indywidualne,N
"Nie da się założyć opaski... - urwałem i odwróciłem lekko głowę kaprala, chcąc się upewnić, że moje palce nie robią mi makabrycznych dowcipów. ",moje palce nie robią mi makabrycznych dowcipów. ,"upewnić się, że_",epistemiczny,past,NF,present,False,indywidualne,N
"Dobrze... chyba nie ma sensu, żebyśmy udawali przed sobą, że nic się nie stało...",nic się nie stało...,"udawać, że_",inne,past,NF,past,False,indywidualne,C
" Kibice z pewnością wierzą, że podczas spotkań ligowych z wynikami będzie dużo lepiej.",podczas spotkań ligowych z wynikami będzie dużo lepiej.,"wierzyć, że_",epistemiczny,present,NF,future,False,indywidualne,N
"Zapłacę - grzebała nerwowo w torebce - chcę mieć pewność, że zostanie zabity.", zostanie zabity,"mieć pewność, że_",epistemiczny,present,NF,future,False,reguła,N
"Sąd Lustracyjny orzekł, że jest ""kłamcą lustracyjnym"", ponieważ w latach 1970 - 78 świadomie i tajnie współpracował z wywiadem wojskowym PRL. ","jest ""kłamcą lustracyjnym""","orzec, że_",mówienia,past,NF,present,False,indywidualne,N
"Miłośnicy historii z tego stowarzyszenia, którzy chcieli przyjechać do Opinogóry na groby leżących na miejscowym cmentarzu szwoleżerów i na grób generała Wincentego Krasińskiego, zaproponowali, że zorganizują w Ciechanowie potyczkę z czasów wojen napoleońskich.",zorganizują w Ciechanowie potyczkę z czasów wojen napoleońskich.,"zaproponować, że_",mówienia,past,NF,future,False,indywidualne,N
"I przypomniał, że Europa i Stany Zjednoczone powinny przestać ze sobą walczyć, a raczej szukać możliwości wspólnych działań."," Europa i Stany Zjednoczone powinny przestać ze sobą walczyć,","przypomnieć komuś, że_",mówienia,past,F,inne,False,indywidualne,E
"Mówi się, że mężczyzna w życiu powinien spłodzić syna... zbudować dom i zasadzić drzewo...",mężczyzna w życiu powinien spłodzić syna... zbudować dom i zasadzić drzewo...,"mówić, że_",mówienia,present,NF,inne,False,reguła,N
"Niemiec powiedział, że zara tu nadejdzie od rządu komisarz i będzie się o nas pytał.",zara tu nadejdzie od rządu komisarz i będzie się o nas pytał.,"powiedzieć, że_",mówienia,past,NF,future,False,indywidualne,N
okazało się. że . przystąpienie do strefy euro. ułatwiało krajom. członkowskim prowadzenie nadmiernie ekspansywnej polityki fiskalnej. nadmiernych deficytów budżetowych,przystąpienie do strefy euro. ułatwiało krajom. członkowskim prowadzenie nadmiernie ekspansywnej polityki fiskalnej. nadmiernych deficytów budżetowych,"okazać się, że_",inne,past,NF,past,False,indywidualne,E
"Zważywszy, że unijna składka Luksemburga wynosi niespełna 296 mln euro rocznie, można śmiało powiedzieć, że najbogatszy kraj UE jest beneficjentem netto unijnej kasy - jak Polska, Rumunia czy Bułgaria.","najbogatszy kraj UE jest beneficjentem netto unijnej kasy - jak Polska, Rumunia czy Bułgaria.","powiedzieć, że_",mówienia,,NF,present,False,indywidualne,N
"Powstańcy żydowscy z warszawskiego getta pokazali, że można godnie upomnieć się o swoje miejsce i umierać za swoją Ojczyznę - Polskę. ",można godnie upomnieć się o swoje miejsce i umierać za swoją Ojczyznę - Polskę. ,"coś pokazało, że_",mówienia,past,NF,inne,False,indywidualne,E
"Wiem, że dopłacam do prądu co miesiąc nawet 7 tysięcy złotych i tak dalej być nie może",dopłacam do prądu co miesiąc nawet 7 tysięcy złotych ,"wiedzieć, że_",epistemiczny,present,F,present,False,indywidualne,E
dyrektorka mi powiedziała że że jako dla nauczycielki to nie ma pracy ale ma jakiś projekt współfinansowany z Unii Europejskiej i że. to by było normalnie osiemnaście godzin czyli cały etat i że bo to są dodatkowe godziny,to by było normalnie osiemnaście godzin czyli cały etat,"powiedzieć, że_",mówienia,past,NF,inne,False,indywidualne,N
"Ale po czasie okazuje się, że trzeźwy też jest uzależniony, a opiekuńczy to tyran. ","trzeźwy też jest uzależniony, a opiekuńczy to tyran. ","okazać się, że_",inne,present,NF,present,False,indywidualne,E
"Taki styl podróżowania odpowiada młodym ludziom bez zobowiązań, niemal pewnym, że nic nie pokrzyżuje im planowanej z wyprzedzeniem zabawy.",nic nie pokrzyżuje im planowanej z wyprzedzeniem zabawy.,"być pewnym, że_",epistemiczny,present,NF,future,False,reguła,N
"Przechodząc do kolejnej kwestii, muszę stwierdzić, że polski Kodeks cywilny zawiera jedynie szczątkową, niewystarczającą regulację problematyki wzorców umownych. ","polski Kodeks cywilny zawiera jedynie szczątkową, niewystarczającą regulację problematyki wzorców umownych. ","stwierdzić, że_",mówienia,present,NF,present,False,indywidualne,N
"W tym trybie (często wymuszanym na poziomie poszczególnych instrukcji za pomocą specyficznych dla danego serwera bazodanowego dyrektyw optymalizatora) można odczytywać dane, o których wiemy, że nie będą w tym samym czasie modyfikowane.",nie będą w tym samym czasie modyfikowane.,"wiedzieć, że_",epistemiczny,present,F,future,False,indywidualne,E
"Ustalono, że 22 marca drugoligowi piłkarze ŁKS zamalowywać będą niestosowne i obraźliwe hasła na murach i ścianach w okolicach Dworca Kaliskiego",22 marca drugoligowi piłkarze ŁKS zamalowywać będą niestosowne i obraźliwe hasła na murach i ścianach w okolicach Dworca Kaliskiego,"[m] ustalić, że_",mówienia,,NF,future,False,indywidualne,N
"Analitycy twierdzą, że jedynym realnym rozwiązaniem dla liczącego 8 mln mieszkańców regionu bałtyckiego są wspólne, regionalne linie lotnicze. "," jedynym realnym rozwiązaniem dla liczącego 8 mln mieszkańców regionu bałtyckiego są wspólne, regionalne linie lotnicze. ","twierdzić, że_",mówienia,present,NF,present,False,indywidualne,N
" U nas w Ameryce jest tak, że jeśli ktoś uważa, że wyświadczona usługa to drobiazg, mówi: ""It's a piece of cake"" - ""To kawałek ciasta"" .",wyświadczona usługa to drobiazg,"uważać, że_",epistemiczny,present,NF,inne,False,reguła,N
"Legenda głosi, że w drodze do Gdańska w 1808 r. poprosił o nocleg w zagrodzie Friedricha Polenza, sołtysa rybackiej wsi Sopot, a rozejrzawszy się po niej stwierdził, że miejsce to nadaje się na uzdrowisko.", miejsce to nadaje się na uzdrowisko.,"stwierdzić, że_",mówienia,past,NF,present,False,indywidualne,N
"Sprawa kompromisu jest na dobrej drodze, no tak, to sobie wyobrażam, że pan premier mógł - to jest tam 13 lipiec, no - pan premier mógł coś takiego powiedzieć panu prezesowi Kwiatkowskiemu, ","pan premier mógł coś takiego powiedzieć panu prezesowi Kwiatkowskiemu, ","wyobrażać sobie, że_2",epistemiczny,present,NF,past,False,indywidualne,N
"Strażacy przypuszczają, że albo podpalenie, albo zaprószenie ognia, albo zwarcie w instalacji elektrycznej. ","albo podpalenie, albo zaprószenie ognia, albo zwarcie w instalacji elektrycznej. ","przypuszczać, że_",epistemiczny,present,NF,inne,False,indywidualne,N
"Ale z drugiej strony przypominam sobie, że przecież razem z nami na tej samej kwaterze mieszkał też Bronek Wildstein, a Bronek Wildstein już wtedy budził pewne onieśmielenie, we wszystkich budził onieśmielenie, a w Zenku pewnie budził onieśmielenie specjalne."," przecież razem z nami na tej samej kwaterze mieszkał też Bronek Wildstein, a Bronek Wildstein już wtedy budził pewne onieśmielenie, we wszystkich budził onieśmielenie, a w Zenku pewnie budził onieśmielenie specjalne.","przypominać sobie, że_",epistemiczny,present,F,past,False,indywidualne,E
"Ciemna noc, zimne łóżko, komu szepnąć mam na uszko , że kocham mojego Misia, aż dostaję w głowie fisia? "," kocham mojego Misia, aż dostaję w głowie fisia? ","szepnąć, że_",mówienia,,NF,present,False,pytajne,N
 ja nie mówię że masz mu wybierać dziewczyny,masz mu wybierać dziewczyny,"mówić, że_",mówienia,past,NF,present,True,indywidualne,N
" Inni znowu uważają, że do upadku neandertalczyków przyczynił się nasz zmysł ekonomiczny. ",do upadku neandertalczyków przyczynił się nasz zmysł ekonomiczny. ,"uważać, że_",epistemiczny,present,NF,past,False,indywidualne,N
"Jeżeli pole to jest polem centralnym, zależnym tylko od odległości cząstek, a niezależnym od kierunku w przestrzeni, to teoria kwantowa przewiduje, że stan o najniższej energii winien mieć zerowy moment pędu i symetrię sferyczną.",stan o najniższej energii winien mieć zerowy moment pędu i symetrię sferyczną.,"przewidywać, że_",epistemiczny,present,NF,inne,False,indywidualne,N
"Nie wiedziałem, Otello na to, że spotykasz się z niewidomą.",spotykasz się z niewidomą.,"wiedzieć, że_",epistemiczny,past,F,present,True,indywidualne,E
"Wiem tylko, że jeździła na wózku cztery lata i że ten jej był okropny. ",jeździła na wózku cztery lata,"wiedzieć, że_",epistemiczny,present,F,past,False,indywidualne,E
"Gdy zniesiono mnie na ląd, byłem już w stanie uwierzyć we wszystko, również w to, że nazywam się Juan de Chinchilla, zaś Diego Carmena, mój przyjaciel został pożarty przez ocean 16 czerwca.","nazywam się Juan de Chinchilla, zaś Diego Carmena, mój przyjaciel został pożarty przez ocean 16 czerwca.","uwierzyć, że_",epistemiczny,past,NF,inne,False,indywidualne,C
"Wiadomo jednak, że zabraknie dwóch profilów nauczania.",zabraknie dwóch profilów nauczania.,"wiadomo, że_",epistemiczny,present,F,future,False,indywidualne,E
"Żałujesz, że tam byłaś?", tam byłaś?,"żałować, że_",emotywny,present,F,past,False,pytajne,E
"Tylko wrodzona skromność powstrzymuje mnie od powiedzenia, że pomysł był genialny. ",pomysł był genialny. ,"powiedzieć, że_",mówienia,present,NF,past,False,indywidualne,N
"Posuwamy się także, według dosadnego określenia Karla Rahnera SJ, nawet do ""fałszerstw moralnych"", udając przy tym, że wszystko jest w porządku.",wszystko jest w porządku.,"udawać, że_",inne,present,NF,present,False,reguła,C
"Przewodniczący komisji ds. Podziału Środków Finansowych dla Ofiar Pożaru, skarbnik miasta J. Pietrzak poinformował, że na koncie pozostało 418 104,02 zł, z tego planuje się wydać na leczenie 372 864,21 zł, a na pomoc socjalną 45 239,81 zł."," na koncie pozostało 418 104,02 zł,","poinformować, że_",mówienia,past,NF,past,False,indywidualne,N
"Tłumaczą, że koliduje im to z zajęciami, że dzieci straciłyby lekcje.","koliduje im to z zajęciami,","tłumaczyć, że_",mówienia,present,NF,present,False,indywidualne,N
ale też zwróćmy uwagę że. właściwie to co mówimy już jest polityczne w naszym kongresie w naszy w naszym przepraszam kontekście krajowym w naszym grajdołku bo teraz nagle okazuje się że pojednanie z Rosją jest własnością. władzy.,pojednanie z Rosją jest własnością. Władzy,"okazać się, że_",inne,present,NF,present,False,indywidualne,E
Andrzej w ogóle jak zdawał relację z tego jak gadał z babką to powiedział że dała mu do zrozumienia że jedno koło by lepsze było tudzież że do zaakceptowania,do zaakceptowania,"dać do zrozumienia, że_",mówienia,past,NF,inne,False,indywidualne,N
"Co mi dał, co zabrał PRL, co mi dała, co zabrała III RP? - zapytała ""Trybuna"" parę osób, w tym Bohdana Łazukę, który odpowiedział szczerze: ""Mówi się, że PRL to był szary okres.",PRL to był szary okres.,"mówić, że_",mówienia,present,NF,past,False,indywidualne,N
"Zapewniono, że doroczna akcja w niczym nie organiczy wakacyjnej pomocy polskim dzieciom, będącym w trudnej sytuacji materialnej.","doroczna akcja w niczym nie organiczy wakacyjnej pomocy polskim dzieciom, będącym w trudnej sytuacji materialnej.","zapewnić, że_",mówienia,,NF,present,False,indywidualne,N
"Trzeba przyznać, że te wyniki robią duże wrażenie.",te wyniki robią duże wrażenie.,"przyznać, że_",mówienia,present,F,present,False,indywidualne,E
"Mój ginekolog mówił, że nikt sie na nie nie skarżył. ", nikt sie na nie nie skarżył. ,"mówić, że_",mówienia,past,NF,past,False,indywidualne,N
"Ale skądinąd wiem, że dla kogoś, kto stracił bliską osobę, był on źródłem pocieszenia, dawał poczucie, że ktoś coś podobnego przeżył, że ktoś go rozumie. "," dla kogoś, kto stracił bliską osobę, był on źródłem pocieszenia","wiedzieć, że_",epistemiczny,present,F,past,False,indywidualne,E
ja mówię o o tym że to była cecha wspólna w Polsce w Niemczech we Francji W Hiszpanii. , to była cecha wspólna w Polsce w Niemczech we Francji W Hiszpanii. ,"mówić, że_",mówienia,present,NF,past,False,indywidualne,N
"Prezydent Ryszard Brezja zapewnia, że wiosną przyszłego roku studenci dostaną od niego klucze do miasta i bawić się będą na pierwszych, historycznych, inowrocławskich juwenaliach","wiosną przyszłego roku studenci dostaną od niego klucze do miasta i bawić się będą na pierwszych, historycznych, inowrocławskich juwenaliach","zapewniać, że_",mówienia,present,NF,future,False,indywidualne,N
"Statystyki mówią, że przestępczość w mieście spadła w ubiegłym roku o prawie 12 procent. ",przestępczość w mieście spadła w ubiegłym roku o prawie 12 procent. ,"mówić, że_",mówienia,present,NF,past,False,indywidualne,N
odpisałam ci że z chęcią zaopiekuję się twoim grzybem,z chęcią zaopiekuję się twoim grzybem,"odpisać, że_",mówienia,past,NF,future,False,indywidualne,N
" Myślę, że się udało.",się udało.,"myśleć, że_",epistemiczny,present,NF,past,False,indywidualne,N
"Niespodziewanie wyszło na jaw, że nie tylko bił narzeczoną, ale także regularnie gwałcił trzyletnią córkę.","nie tylko bił narzeczoną, ale także regularnie gwałcił trzyletnią córkę.","wyjść na jaw, że_",inne,past,F,past,False,indywidualne,E
"Śniły mi się jabłka - renety, cocsa [?], że je kupowałam, a potem, że byłam na odczycie Stanisława Wojciechowskiego (!!).", byłam na odczycie Stanisława Wojciechowskiego (!!).,"śnić się, że_",epistemiczny,past,NF,past,False,indywidualne,N
"Ciągle słyszę, że na coś prawo nie pozwala. ",na coś prawo nie pozwala. ,"słyszeć, że_[mowa]",mówienia,present,NF,present,False,indywidualne,N
"Sekretarka powiedziała mi, że pani już dzisiaj nie będzie…", pani już dzisiaj nie będzie…,"powiedzieć, że_",mówienia,past,NF,future,False,indywidualne,C
"Chyba po 47 latach pracy możemy oczekiwać, że informacja o emeryturze nie będzie miała formy listu gończego.",informacja o emeryturze nie będzie miała formy listu gończego.,"oczekiwać, że_",epistemiczny,present,NF,present,False,indywidualne,N
"Po raz pierwszy rachunki odnotowały obecność drugiej żony Jagiełły w Nowym Mieście w listopadzie 1403 roku, ale wiele wskazuje na to, że królowa przyjeżdżała tu wcześniej.",królowa przyjeżdżała tu wcześniej.,"wskazywać, że_",epistemiczny,present,NF,past,False,indywidualne,N
"I jeśli się boisz, że wpadnę w czarną rozpacz, gdyby się okazało, że to jednak na darmo, to spoko. ",wpadnę w czarną rozpacz,"bać się, że_",epistemiczny,present,NF,future,False,warunkowe,N
"Mówi dużo o walce z przekrętami na Wall Street, ale nawet nie wie, że w bojach politycznych wspiera się od dawna na funduszach hedgingowych i działach inwestycyjnych wielkich banków, a więc tych miejscach, które wcześniej pilnie śledził","w bojach politycznych wspiera się od dawna na funduszach hedgingowych i działach inwestycyjnych wielkich banków,","wiedzieć, że_",epistemiczny,present,F,present,True,indywidualne,E
"Każdy się łudził, że stosunki jakoś się ułożą. ",stosunki jakoś się ułożą. ,"łudzić się, że_",epistemiczny,past,NF,future,False,indywidualne,C
"Na oko wydaje się, że przynajmniej indywidualny przydomek jest jasno motywowany przez wyraz pospolity góral 'mieszkaniec gór' i zapewne tak jest w następującym tekście",przynajmniej indywidualny przydomek jest jasno motywowany przez wyraz pospolity góral 'mieszkaniec gór' i,"wydaje się, że_",epistemiczny,present,NF,present,False,indywidualne,N
mówiliśmy o tym że dzieci często są przez chwilę jakoś w rodzinnym domu dziecka ,dzieci często są przez chwilę jakoś w rodzinnym domu dziecka ,"mówić, że_",mówienia,past,NF,present,False,indywidualne,E
ja słyszałem że przy załadunku miałem być teraz już, przy załadunku miałem być teraz już,"słyszeć, że_[mowa]",mówienia,past,NF,past,False,indywidualne,N
 nie wie nie wie nie wiedziałem że będziemy. y będziemy brać udział dziś w świąteczny dzień kampanii parlamentarnej do europarlamentu,będziemy. y będziemy brać udział dziś w świąteczny dzień kampanii parlamentarnej do europarlamentu,"wiedzieć, że_",epistemiczny,past,F,future,True,indywidualne,E
"Kiedy po kilku dniach mężczyzna zadzwonił pod policyjny numer 997 zrozumiał, że popełnił błąd.",popełnił błąd.,"zrozumieć, że_",epistemiczny,past,F,past,False,indywidualne,E
"Myślę, że ten problem zdecydowanie umyka uwagi.",ten problem zdecydowanie umyka uwagi.,"myśleć, że_",epistemiczny,present,NF,present,False,indywidualne,N
"Rozumiem, chociaż przysięgam, że ja nigdy nie podsłuchuję i jak nawet coś słyszę, to przypadkowo...",ja nigdy nie podsłuchuję,"przysięgać, że_",mówienia,present,NF,present,False,performatyw,N
"W Urzędzie Marszałkowskim w Kielcach, wydającym zezwolenia na przewóz osób, dowiedzieliśmy się, że nie ma przepisów, które osobom karanym nakazywałyby odbierać koncesje czy licencje."," nie ma przepisów, które osobom karanym nakazywałyby odbierać koncesje czy licencje.","dowiedzieć się, że_",epistemiczny,past,F,present,False,indywidualne,E
"Portrety malarskie i rzeźbiarskie pokazane na Wystawie Ogólnopolskiej jak i portrety, które mogliśmy oglądać na wystawach przodowników pracy, świadczą, że plastykom nie udało się dotychczas wyłamać z mieszczańskiej konwencji izolowania i neutralizowania jednostki ludzkiej, że nie potrafią jeszcze pokazać jej w konkretnej sytuacji, w konkretnym powiązaniu z otoczeniem, że wciąż jeszcze ciąży nad nimi dziedzictwo portretu reprezentacyjnego, pełnego sztuczności i nudy."," nie potrafią jeszcze pokazać jej w konkretnej sytuacji, w konkretnym powiązaniu z otoczeniem, ","świadczyć, że_",epistemiczny,present,NF,present,False,indywidualne,N
"Okazało się, że tam w górze, nad naszymi głowami, znów zaszła radykalna zmiana. ","tam w górze, nad naszymi głowami, znów zaszła radykalna zmiana. ","okazać się, że_",inne,past,NF,past,False,indywidualne,E
"Choć nie dysponujemy danymi dotyczącymi wszystkich banków, jednak z fragmentarycznych informacji można wnioskować, że banki udzielają coraz mniej kredytów. ", banki udzielają coraz mniej kredytów. ,"wnioskować, że_",epistemiczny,present,NF,present,False,indywidualne,N
Wystarczy mocno wierzyć że wszystko będzie dobrze i nie zawahać się ani chwili.,wszystko będzie dobrze,"wierzyć, że_",epistemiczny,present,NF,future,False,indywidualne,N
"P. Sytek uważa, że psie toalety powinny znaleźć się w widocznych miejscach oraz w takich punktach, by właścicieli nie musieli pokonywać pół osiedla, by do nich dotrzeć.","psie toalety powinny znaleźć się w widocznych miejscach oraz w takich punktach, by właścicieli nie musieli pokonywać pół osiedla, by do nich dotrzeć.","uważać, że_",epistemiczny,present,NF,inne,False,indywidualne,N
"Uważam, że władze nie mają prawa w ten sposób terroryzować mieszkańców",władze nie mają prawa w ten sposób terroryzować mieszkańców,"uważać, że_",epistemiczny,present,NF,present,False,indywidualne,N
"Narzekał, że Urszula źle prasuje jego koszule, że robi fałdki i zmarszczki, że kołnierzyk nie jest dość gładki, a gazeta nigdy nie leży tam, gdzie ją zostawił. ","robi fałdki i zmarszczki,","narzekać, że_",mówienia,past,NF,present,False,indywidualne,N
"Czyli de facto mamy błędne koło – i warto pamiętać, że nie tylko sama PKP jest winna tego, że transport kolejowy działa w Polsce coraz gorzej.","nie tylko sama PKP jest winna tego, że transport kolejowy działa w Polsce coraz gorzej.","pamiętać, że_",epistemiczny,present,F,present,False,indywidualne,E
"Prezes Kaczyński przyznał, że to na razie dla niego za trudne. ",to na razie dla niego za trudne. ,"przyznać, że_",mówienia,past,F,inne,False,indywidualne,E
" Jeśli w 1995 r. 17 proc. osób odpowiadało, że uważnie je ogląda, to w bieżącym taką deklarację złożyło już tylko 7 proc., z czego zaledwie 4 proc. przyznało, że robi to z zainteresowaniem. ", robi to z zainteresowaniem. ,"przyznać, że_",mówienia,past,F,present,False,indywidualne,E
"Taniec - chyba jakoś podskakiwać umiem, cieszę się, że przetrwałam własne wesele;",przetrwałam własne wesele;,"cieszyć się, że_",emotywny,present,F,past,False,indywidualne,E
"Wiedzą jednak, że konieczna jest przynajmniej średnia znajomość języka obcego.",konieczna jest przynajmniej średnia znajomość języka obcego.,"wiedzieć, że_",epistemiczny,present,F,present,False,indywidualne,E
"Ustalono, że łączą go z niektórymi członkami grupy bliskie stosunki towarzyskie i że osoby te kontaktują sędziego z wałbrzyskimi przestępcami.", łączą go z niektórymi członkami grupy bliskie stosunki towarzyskie ,"ustalić [na podstawie czegoś], że_",epistemiczny,past,NF,present,False,indywidualne,N
"Należy pamiętać, że rynek ubezpieczeń, jaki znamy obecnie, to rynek na dnie ogólnoświatowej dekoniunktury. ","rynek ubezpieczeń, jaki znamy obecnie, to rynek na dnie ogólnoświatowej dekoniunktury. ","pamiętać, że_",epistemiczny,present,F,inne,False,indywidualne,E
"Suchecki zajmuje się kalendarzem, jeździ ze swoim szefem w teren, zdarza się nawet, że załatwia sprawy rodzinne Kalinowskiego. ",załatwia sprawy rodzinne Kalinowskiego.,"zdarzać się, że_",inne,present,NF,present,False,indywidualne,E
"Można wręcz powiedzieć, że powstało obok siebie kilka konkurencyjnych zestawów tak zwanych autorytetów.",powstało obok siebie kilka konkurencyjnych zestawów tak zwanych autorytetów.,"powiedzieć, że_",mówienia,,NF,past,False,indywidualne,N
"Przyjmując moją odmowę z powściągliwą uprzejmością oświadczył, że chata jego zaczeka, dopóki nie dokonamy zdjęć.","chata jego zaczeka, dopóki nie dokonamy zdjęć.","oświadczyć, że_",mówienia,past,NF,future,False,indywidualne,N
"Małgorzata Foremniak, słynna doktor Zosia z serialu ""Na dobre i na złe"", która w tym roku odcisnęła swoją dłoń w alei gwiazd w Międzyzdrojach, żali się, że ustalając wysokość honorariów nie każdy producent liczy się z tym, że popularny aktor, którego akcje idą w górę, ma prawo do wyższych stawek. ","ustalając wysokość honorariów nie każdy producent liczy się z tym, że popularny aktor, którego akcje idą w górę, ma prawo do wyższych stawek. ","żalić się, że_",mówienia,present,NF,present,False,indywidualne,N
"Tak, ja myślę, że właśnie dlatego został pan obwołany faszystą.",właśnie dlatego został pan obwołany faszystą.,"myśleć, że_",epistemiczny,present,NF,past,False,indywidualne,N
"Skorom powrócił do domu, ojciec mój, nakupiwszy sukna, sajety i bławatu, posłał do miasta po Żydów-krawców, dla zrobienia mi sukien; uważałem, że na coś się wielkiego zanosi.",na coś się wielkiego zanosi.,"uważać, że_",epistemiczny,past,NF,present,False,indywidualne,N
wydawałoby się oczywiste że wola należy yy yy do zmarłego ale domyślam się że mogą być różne sytuacje kiedy zmarły życzy sobie tak a rodzina mówi nie ślub yyy ślub pogrzeb będzie yyy kościelny ,wola należy yy yy do zmarłego,"wydaje się, że_",epistemiczny,,NF,present,False,indywidualne,N
"Ci z koalicji rządzącej, ci posłowie, którzy w trakcie posiedzenia sejmowej Komisji Polityki Gospodarczej, Budżetu i Finansów z uporem, myślę, godnym lepszej sprawy, bronili faktu, aby rząd łącznie z budżetem - zapowiadam, łącznie z budżetem, bo mamy świadomość, że nie było i nie ma czasu na to, żeby wcześniej rozpatrywać założenia, a potem przedkładać budżet - przedłożył założenia polityki społeczno-gospodarczej, jako dokumentu ujmującego tę politykę w dłuższym czasie, posłowie, którzy nie dopuścili do takiego rozstrzygnięcia - przypominam, tylko jednym głosem - źle służą również rządowi.","nie było i nie ma czasu na to, żeby wcześniej rozpatrywać założenia, a potem przedkładać budżet ","mieć świadomość, że_",epistemiczny,present,F,past,False,indywidualne,E
"Nie zrobiłem tego i im dalej idę w lata - tym pewniej wiem, że postąpiłem słusznie. ", postąpiłem słusznie. ,"wiedzieć, że_",epistemiczny,present,F,past,False,indywidualne,E
"Uważam, że każdy pracownik powinien być poinformowany o ewentualnym wpływie podejmowanej pracy na zdrowie przyszłego dziecka.",każdy pracownik powinien być poinformowany o ewentualnym wpływie podejmowanej pracy na zdrowie przyszłego dziecka.,"uważać, że_",epistemiczny,present,NF,inne,False,indywidualne,N
