T PL,H PL,verb,verb - main semantic class,verb - tense,verb - factive/nonfactive,complement - tense,T - negation,T - type of sentence,"GOLD <T,H>"
"Mówiło się, że nawet bili się na pięści.",nawet bili się na pięści.,"mówić, że_",mówienia,past,NF,past,False,indywidualne,N
"Ja jednak miałem w zanadrzu pisemko od lekarza akademickiej izolatki, który badał mnie zaraz po owej służbie wartowniczej i w pisemku swym zaświadczał, że miałem czterdzieści stopni gorączki - naprawdę miałem! - że nie bardzo rozumiałem, co do mnie wtedy mówiono ani co sam mówiłem i robiłem, i że nie powinienem był w takim stanie w ogóle pełnić żadnej służby. ",nie powinienem był w takim stanie w ogóle pełnić żadnej służby. ,"zaświadczać, że_",mówienia,past,NF,past,False,indywidualne,N
"Zalani łzami zgłaszamy się do punktów krwiodawstwa, oddajemy w ramach pomocy rzeczy, które już dawno przestały nam się podobać albo których kompletnie nie potrzebujemy, stuprocentowo pewni, że ofiarę kataklizmu najbardziej uraduje prawie chanelowski żakiecik, w który już się nie mieścimy.","ofiarę kataklizmu najbardziej uraduje prawie chanelowski żakiecik,","być pewnym, że_",epistemiczny,present,NF,future,False,reguła,N
"Ja rozumiem, że oni nie mogą należeć do partii politycznych.",oni nie mogą należeć do partii politycznych.,"rozumieć, że_",epistemiczny,present,F,present,False,indywidualne,E
"Jednak ludzie bardzo ciężko chorzy, gdy już czują, że medycyna też nie może im już pomóc, chcą skorzystać z tego sposobu leczenia.",medycyna też nie może im już pomóc,"[e] czuć, że_",epistemiczny,present,NF,present,False,reguła,N
"Wydaje się, że brutalizacja dnia powszedniego osiągnęła swoje apogeum.",brutalizacja dnia powszedniego osiągnęła swoje apogeum.,"wydaje się, że_",epistemiczny,present,NF,past,False,indywidualne,N
"Powiedział mi, że gdy taksówka przyjechała po niego, na liczniku już było 8,50 zł."," gdy taksówka przyjechała po niego, na liczniku już było 8,50 zł.","powiedzieć, że_",mówienia,past,NF,past,False,indywidualne,N
"Rozumiem, że jak jest propozycja, to się o niej dyskutuje.","jak jest propozycja, to się o niej dyskutuje.","rozumieć coś w jakis sposób, że_",epistemiczny,present,NF,inne,False,indywidualne,N
"Jednak zdarza się, że bardzo agresywni ludzie świetnie sobie radzą.", bardzo agresywni ludzie świetnie sobie radzą.,"zdarzać się, że_",inne,present,NF,present,False,indywidualne,E
"Właściciele narzekali, że przez alarm bombowy i blokadę Piotrkowskiej stracą klientów i pieniądze. ",przez alarm bombowy i blokadę Piotrkowskiej stracą klientów i pieniądze. ,"narzekać, że_",mówienia,past,NF,future,False,indywidualne,N
"Okazuje się poza tym, że szanse powodzenia będą mieć zwłaszcza ci kandydaci, które odznaczają się... starannością w piśmie.","szanse powodzenia będą mieć zwłaszcza ci kandydaci, które odznaczają się... starannością w piśmie","okazywać się, że_",inne,present,NF,future,False,indywidualne,E
"Domyśliłem się, że należał kiedyś do Piastowego, ale po tym, jak zmuszony był przesiąść się na wózek, odstawiono go na bocznicę, by nauczyciel mógł bez przeszkód zajmować miejsce naprzeciwko telewizora.","należał kiedyś do Piastowego,","domyślić się, że_",epistemiczny,past,F,past,False,indywidualne,E
"Benedyktyn Mateusz Paris (ok. 1200-1259) wspomniał, że po otwarciu grobu hrabiego Pembroke w 1240 roku okazało się, że jego zwłoki znajdują się w stanie daleko posuniętego rozkładu i obrzydliwie śmierdzą, i uznał to za dowód jego wielkiej grzeszności za życia. "," po otwarciu grobu hrabiego Pembroke w 1240 roku okazało się, że jego zwłoki znajdują się w stanie daleko posuniętego rozkładu i obrzydliwie śmierdzą","wspomnieć, że2_",mówienia,past,NF,past,False,indywidualne,N
"Tłumaczą, że koliduje im to z zajęciami, że dzieci straciłyby lekcje. ",dzieci straciłyby lekcje. ,"tłumaczyć, że_",mówienia,present,NF,inne,False,indywidualne,N
"Przypominam, że Komisja Praw Człowieka i Praworządności przedstawiła projekt uchwały, w którym wnosiła o przyjęcie tej ustawy bez poprawek.","Komisja Praw Człowieka i Praworządności przedstawiła projekt uchwały, w którym wnosiła o przyjęcie tej ustawy bez poprawek.","przypominać komuś, że_",mówienia,present,F,past,False,performatyw,E
"Powtarzające się pogłoski o niedalekiej już próbie przejęcia tego banku przez któregoś z zagranicznych gigantów sprawiły, że popyt na akcje BIG BG znów nie został zaspokojony. ",popyt na akcje BIG BG znów nie został zaspokojony. ,"sprawić, że_",inne,past,NF,past,False,indywidualne,E
"Pewnie łatwo będzie pokazać, że mamy z czego razem być dumni.",mamy z czego razem być dumni.,"pokazać, że_",mówienia,future,F,present,False,indywidualne,E
"Opozycja ogłosiła więc, że zwolnienia mają charakter politycznej czystki, a do pracy wracają esbecy. "," zwolnienia mają charakter politycznej czystki,","ogłosić, że_",mówienia,past,NF,present,False,indywidualne,N
"Po prostu czuję, że powinienem zgnić w kryminale i jestem z tego dumny.",powinienem zgnić w kryminale,"[e] czuć, że_",epistemiczny,present,NF,inne,False,indywidualne,N
"Portrety malarskie i rzeźbiarskie pokazane na Wystawie Ogólnopolskiej jak i portrety, które mogliśmy oglądać na wystawach przodowników pracy, świadczą, że plastykom nie udało się dotychczas wyłamać z mieszczańskiej konwencji izolowania i neutralizowania jednostki ludzkiej, że nie potrafią jeszcze pokazać jej w konkretnej sytuacji, w konkretnym powiązaniu z otoczeniem, że wciąż jeszcze ciąży nad nimi dziedzictwo portretu reprezentacyjnego, pełnego sztuczności i nudy.","wciąż jeszcze ciąży nad nimi dziedzictwo portretu reprezentacyjnego, pełnego sztuczności i nudy.","świadczyć, że_",epistemiczny,present,NF,present,False,indywidualne,N
"W szkole liczą, że może starostwo dołoży parę groszy i w ten sposób uda się zatrudnić pielęgniarkę na stałe", może starostwo dołoży parę groszy i w ten sposób uda się zatrudnić pielęgniarkę na stałe,"liczyć, że_",epistemiczny,present,NF,future,False,indywidualne,N
"Myślę, że jeżeli taka propozycja została skierowana, to zdaje się, wynikła z tego, że tym się ostatnio, niestety, prezesi zajmowali, zamiast porządkować działalność ubezpieczeniową swojej firmy."," jeżeli taka propozycja została skierowana, to zdaje się, wynikła z tego, że tym się ostatnio, niestety, prezesi zajmowali, ","myśleć, że_",epistemiczny,present,NF,inne,False,indywidualne,N
"Wie, że nie był, nie jest i już nie będzie wirtuozem.","nie był, nie jest i już nie będzie wirtuozem.","wiedzieć, że_",epistemiczny,present,F,inne,False,indywidualne,E
"Myślałem, że kupimy za te pieniądze cukierków i kwasu - wtrącił płaczliwie Boria.",kupimy za te pieniądze cukierków i kwasu,"myśleć, że_",epistemiczny,past,NF,future,False,indywidualne,C
"Musi pamiętać o tym, że nie wolno mu obarczać swoich podwładnych złymi nastrojami zwierzchników (a także swoimi humorami). ",nie wolno mu obarczać swoich podwładnych złymi nastrojami zwierzchników,"pamiętać, że_",epistemiczny,present,F,present,False,indywidualne,E
"Być może, to właśnie powojenny chaos, przyziemne trudności komunikacyjne oraz niepewna sytuacja ukraińskich emigrantów sprawiły, że Kedryn nie nawiązał kontaktu z redaktorem ""Kultury"" w czasie swojego pobytu w Europie. "," Kedryn nie nawiązał kontaktu z redaktorem ""Kultury"" w czasie swojego pobytu w Europie. ","sprawiać, że_",inne,past,NF,past,False,indywidualne,E
twierdzę że PiS się rozpadnie,PiS się rozpadnie,"twierdzić, że_",mówienia,present,NF,future,False,indywidualne,N
"Krzysztof Sikora podczas uroczystości podkreślił, że szczególne gratulacje należą się Januszowi Radzikowskiemu i Januszowi Kiszce.",szczególne gratulacje należą się Januszowi Radzikowskiemu i Januszowi Kiszce.,"podkreślić, że_",mówienia,past,NF,present,False,indywidualne,N
"Rozumiem, że znowu będę tu siedziała sama przez cały dzień. ",znowu będę tu siedziała sama przez cały dzień. ,"rozumieć coś w jakiś sposób, że_",epistemiczny,present,NF,future,False,indywidualne,N
"Dyrektora nie zastałam, ale jego przemiła asystentka sprawiła, że w Izbie Przyjęć Szpitala Wojewódzkiego w pokoju ortopedy zdjęto ojcu szynę gipsową. ", w Izbie Przyjęć Szpitala Wojewódzkiego w pokoju ortopedy zdjęto ojcu szynę gipsową. ,"sprawić, że_",inne,past,NF,past,False,indywidualne,E
"Zwykle pracuję od 8.30 do 20.30, ale bywa, że i do północy.",i do północy.,"bywać, że_",inne,present,NF,inne,False,indywidualne,E
"William Wedin, psycholog pomagający biseksom w Nowym Jorku, twierdzi, że odkrycie związku męża z innym mężczyzną (a dwie trzecie znanych mu mężczyzn bi było żonatych, głównie z kobietami hetero) rujnuje zwykle małżeństwo.",odkrycie związku męża z innym mężczyzną rujnuje zwykle małżeństwo.,"twierdzić, że_",mówienia,present,NF,present,False,indywidualne,N
"Przeliczając to na prawie 20 000 studentów psychologii w całym kraju, łatwo obliczyć, że profesor psychologii to cenny nabytek.",profesor psychologii to cenny nabytek.,"obliczyć, że_",epistemiczny,present,NF,present,False,indywidualne,N
"Dębski zapowiedział, że to, kim był ów wysoki funkcjonariusz, ujawni tylko Buzkowi lub Krzaklewskiemu.","to, kim był ów wysoki funkcjonariusz, ujawni tylko Buzkowi lub Krzaklewskiemu.","zapowiedzieć, że_",mówienia,past,NF,future,False,indywidualne,N
"Wypowiedź Barszcza dlatego mnie zachwyciła, gdyż odbiega dramatycznie od metod zwalczania korupcji uprawianych przez rząd, który sądzi, że za pomocą pokazowych aresztowań uda się zwalczyć tę patologię.", za pomocą pokazowych aresztowań uda się zwalczyć tę patologię.,"sądzić, że_",epistemiczny,present,NF,future,False,indywidualne,N
 powiedziała że nie chce ,nie chce ,"powiedzieć, że_",mówienia,past,NF,present,False,indywidualne,N
 ja myślałem że to jest szampan nie ? że w promocji był do piwa. natomiast. to to jest piwo,to jest szampan ,"myśleć, że_",epistemiczny,past,NF,present,False,indywidualne,C
"Tak, olbrzymie są już - powiedział z roztargnieniem Wiktor - nie wiedziałem wcale, że wyszłaś za mąż. ",wyszłaś za mąż. ,"wiedzieć, że_",epistemiczny,past,F,past,True,indywidualne,E
"Czyż nie wiedziałaś, Czarodziejko, że tajemnica Twej boskiej natury mogła cały czas na mnie spadać siecią Twego niekończącego się urok u ?",tajemnica Twej boskiej natury mogła cały czas na mnie spadać siecią Twego niekończącego się urok u ,"wiedzieć, że_",epistemiczny,past,F,past,True,pytajne,E
"Mówiła, że wolała się czołgać niż na nim jeździć.",wolała się czołgać niż na nim jeździć.,"mówić, że_",mówienia,past,NF,past,False,indywidualne,N
"Większość twierdzi że jestem przykładem pesymistki a to tylko dlatego że nigdy nie robię sobie nadziei i wymyślam najgorsze scenariusze wszystkich wydarzeń, żeby się nie zawieść...",jestem przykładem pesymistki,"twierdzić, że_",mówienia,present,NF,present,False,indywidualne,N
"Przypomnijmy, że w naszym redakcyjnym gronie mamy dwoje publicystów z tytułem Dziennikarza Roku: Janinę Paradowską i Jacka Żakowskiego.",w naszym redakcyjnym gronie mamy dwoje publicystów z tytułem Dziennikarza Roku,"przypominać komuś, że_",mówienia,,F,present,False,performatyw,E
 i powiem. że ja też się urodziłem przez cesarskie cięcie. , ja też się urodziłem przez cesarskie cięcie. ,"powiedzieć, że_",mówienia,future,NF,past,False,indywidualne,N
"kierowca nie musi się zbytnio interesować działaniem poszczególnych modeli samochodów, ponieważ wie, że każdy z nich uruchamiany jest poprzez przekręcenie kluczyka w stacyjce, a prowadzenie maszyny możliwe jest dzięki zmianie biegów oraz odpowiedniemu używaniu sprzęgła, gazu i hamulca.","każdy z nich uruchamiany jest poprzez przekręcenie kluczyka w stacyjce, a prowadzenie maszyny możliwe jest dzięki zmianie biegów oraz odpowiedniemu używaniu sprzęgła, gazu i hamulca.","wiedzieć, że_",epistemiczny,present,F,present,False,indywidualne,E
"Były to jeszcze czasy ogromnej popularności grunge'u - stylu, który uświadomił, że zwykły rock znów może być czymś niezwykłym dla milionowych audytoriów. ", zwykły rock znów może być czymś niezwykłym dla milionowych audytoriów.,"uświadomić sobie, że_",epistemiczny,past,F,present,False,indywidualne,E
"Okazało się, że to Lepper wyprawia imieniny. ",to Lepper wyprawia imieniny. ,"okazać się, że_",inne,past,NF,present,False,indywidualne,E
"Był za to pewien, że jakby zobaczył taką kobrę w ataku, odczuł by to samo, co dziś gdy spojrzał Jurkowi w oczy."," jakby zobaczył taką kobrę w ataku, odczuł by to samo, co dziś gdy spojrzał Jurkowi w oczy.","być pewnym, że_",epistemiczny,past,NF,inne,False,indywidualne,N
"Nas nikt nawet nie poinformował, że stadion idzie pod młotek.", stadion idzie pod młotek.,"poinformować, że_",mówienia,past,NF,inne,True,indywidualne,E
 Ania cos tam tłumaczyła że jestem koleżanka ze szkoły, jestem koleżanka ze szkoły,"tłumaczyć, że_",mówienia,past,NF,present,False,indywidualne,N
"Ja w każdej chwili jestem do państwa dyspozycji i jeżeli tylko uznacie, że moja obecność w czasie tej rozmowy jest potrzebna to stawię się natychmiast.",moja obecność w czasie tej rozmowy jest potrzebna,"uznać, że_",epistemiczny,future,NF,present,False,warunkowe,N
myślę że tak naprawdę wszyscy,tak naprawdę wszyscy,"myśleć, że_",epistemiczny,present,NF,inne,False,indywidualne,N
"Tymczasem Sejm zdecydował wczoraj, że pieniądze otrzymają tylko ci, którzy dostają zasiłek rodzinny."," pieniądze otrzymają tylko ci, którzy dostają zasiłek rodzinny.","zdecydować, że_",inne,past,NF,future,False,indywidualne,N
"Lamentujemy nad ginącymi gatunkami, czy to roślin, czy zwierząt, a kiedy udaje się je odratować, okazuje się, że lepiej było, jak stanowiły nieliczną grupę, ponieważ teraz zaczęły nam, ludziom, przeszkadzać."," lepiej było, jak stanowiły nieliczną grupę, ","okazywać się, że_",inne,present,NF,past,False,indywidualne,E
"Wiem, że cyklicznie się spotyka.",cyklicznie się spotyka.,"wiedzieć, że_",epistemiczny,present,F,present,False,indywidualne,E
"Trudno więc się dziwić, że stał się najlepiej sprzedającym się samolotem na świecie. ", stał się najlepiej sprzedającym się samolotem na świecie. ,"dziwić się, że_",epistemiczny,,F,past,False,indywidualne,E
" Trzeba przy tym pamiętać, że człowiek wynosi z rodzinnego domu niesłychanie silne przyzwyczajenia, także jeśli chodzi o sposób gospodarowania pieniędzmi.", człowiek wynosi z rodzinnego domu niesłychanie silne przyzwyczajenia,"pamiętać, że_",epistemiczny,,F,present,False,indywidualne,E
"Trudno bowiem mówić, że suto opłacana „produkcja” menedżerów i innych specjalistów od zarządzania, propagowana od lat, nie wycisnęła swego piętna na wspomnianej statystyce. ","suto opłacana „produkcja” menedżerów i innych specjalistów od zarządzania, propagowana od lat, nie wycisnęła swego piętna na wspomnianej statystyce. ","mówić, że_",mówienia,,NF,past,False,indywidualne,N
"Dodaje, że już co najmniej od półtora roku jej pracownicy za darmo przyjmują od klientów zużyte telewizory, pralki i lodówki. "," już co najmniej od półtora roku jej pracownicy za darmo przyjmują od klientów zużyte telewizory, pralki i lodówki. ","dodawać, że_",mówienia,present,NF,present,False,indywidualne,N
"Powiedziałbym im, że siostra dzięki zamianie literek ze zwykłej Marysi przemienia się w bohaterską Marusię i nie czuje się już gorsza od kolegów z podwórka.",siostra dzięki zamianie literek ze zwykłej Marysi przemienia się w bohaterską Marusię i nie czuje się już gorsza od kolegów z podwórka.,"powiedzieć, że_",mówienia,,NF,present,False,kontrfaktyczne,N
"Paragraf 21 mówi o tym, że towar musi być wymieniony na nowy, chyba że kupiliśmy rzeczy używane. ","towar musi być wymieniony na nowy,","mówić, że_",mówienia,present,NF,present,False,indywidualne,N
mówisz że ma radochę..,ma radochę..,"mówić, że_",mówienia,present,NF,present,False,indywidualne,N
"Ewa Wilk słusznie napisała [art. ""Dramat obowiązkowy"", POLITYKA 18], że zadaniem szkoły jest wyrobienie w uczniu ""elementarnych kompetencji: odróżniania, selekcjonowania, samodzielności oceny, odporności na propagandę"". ","zadaniem szkoły jest wyrobienie w uczniu ""elementarnych kompetencji","napisać, że_",mówienia,past,NF,present,False,indywidualne,N
"W polu Kryteria: kolumny Imie wpisz w cudzysłowie imię osoby, o której wiesz, że i tak nigdy nie odda pożyczonych filmów (rysunek 4.20).",i tak nigdy nie odda pożyczonych filmów,"wiedzieć, że_",epistemiczny,present,F,future,False,reguła,N
"Republikanie zacierają ręce, cieszą się, że swoim megalomańskim wystąpieniem Clinton nie pomógł Gore’owi ani na jotę. ",swoim megalomańskim wystąpieniem Clinton nie pomógł Gore’owi ani na jotę. ,"cieszyć się, że_",emotywny,present,F,past,False,indywidualne,E
" Za dwa lata trudno będzie sobie przypomnieć, że tego tunelu kiedyś nie było.",tego tunelu kiedyś nie było.,"przypomnieć sobie, że_",epistemiczny,future,F,past,False,indywidualne,E
"Udaje, że zna",zna,"udawać, że_",inne,present,NF,present,False,indywidualne,C
"Niektórzy politycy jeszcze przed wyjazdem martwili się, że jednak nie wszystkie przyjemności będą dozwolone. ",jednak nie wszystkie przyjemności będą dozwolone. ,"martwić się, że_",epistemiczny,past,NF,future,False,indywidualne,N
" Sam inspektor Spałek dobitnie stwierdził, że została wykonana fuszerka i zlecił powtórne wykonanie prac.", została wykonana fuszerka i zlecił powtórne wykonanie prac.,"stwierdzić, że_",mówienia,past,NF,past,False,indywidualne,N
"Myślę, że powinien pan to jeszcze raz przejrzeć.",powinien pan to jeszcze raz przejrzeć.,"myśleć, że_",epistemiczny,present,NF,inne,False,indywidualne,N
"Warto jednak podkreślić, że dzieje się tak głównie za sprawą zapobiegliwości najbogatszych i najbardziej obrotnych Polaków. ", dzieje się tak głównie za sprawą zapobiegliwości najbogatszych i najbardziej obrotnych Polaków. ,"podkreślić, że_",mówienia,present,NF,present,False,indywidualne,N
"Przeciwnie, uważano, że teraz niebezpieczeństwo było już beznadziejnie śmiertelne, bo, jak się okazało, nikt nie miał odwagi powstrzymać świata, który od dłuższego czasu staczał się nieuchronnie w przepaść.",teraz niebezpieczeństwo było już beznadziejnie śmiertelne,"uważać, że_",epistemiczny,,NF,past,False,indywidualne,N
"Gdy przybyli, okazało się, że nie ma żadnych ciał.",nie ma żadnych ciał.,"okazać się, że_",inne,past,NF,present,False,indywidualne,E
"Pomyśleć, że 20 lat temu był to świetny samorządowiec. ", 20 lat temu był to świetny samorządowiec. ,"POMYŚLEĆ, że_",epistemiczny,,F,past,False,indywidualne,E
"Ta różnorodność sprawia, że nie popada się w męczącą rutynę, bo raz trzeba wysłuchać całej historii życia klienta, innym razem poznawać tajniki działania największych firm.","nie popada się w męczącą rutynę,","sprawiać, że_",inne,present,NF,present,False,indywidualne,E
"Po dotarciu do końca prezentacji codziennego rachunku sumienia chętnie dopowiem, że warto podjąć to wielce obiecujące ćwiczenie się w tym rodzaju modlitwy.", warto podjąć to wielce obiecujące ćwiczenie się w tym rodzaju modlitwy.,"dopowiedzieć, że_",mówienia,future,NF,inne,False,indywidualne,N
"Nie należy dziwić się, że jesteśmy bardziej podenerwowani i podatni na agresję.",jesteśmy bardziej podenerwowani i podatni na agresję.,"dziwić się, że_",epistemiczny,present,F,present,True,indywidualne,E
"Powiedział, że zamiast tego wolałby dostać nawet 5 tys. złotych grzywny",zamiast tego wolałby dostać nawet 5 tys. złotych grzywny,"powiedzieć, że_",mówienia,past,NF,inne,False,indywidualne,N
"jedną z konsekwencji wprowadzenia zakazu wydawania ciepłych posiłków (uzasadnianego tym, że stoczniowcy mają „pracować, a nie przesiadywać w barach”) był fakt, że w zimie na przełomie 2001/2002 roku część stoczniowców pracujących na mrozie nie miała możliwości napicia się ciepłych napojów. "," ""stoczniowcy mają „pracować, a nie przesiadywać w barach”","uzasadniać, że_",mówienia,,NF,present,False,indywidualne,N
"Masz zamiar udawać, że nic się nie stało?",nic się nie stało?,"udawać, że_",inne,present,NF,past,False,pytajne,C
"Wyjście z więzienia zbiega się czasem z tą wspaniałą sytuacją, że dziecko bierze w końcu odpowiedzialność za swoje życie rozumiejąc, że ma je tylko jedno. ",ma je tylko jedno. ,"rozumieć, że_",epistemiczny,present,F,present,False,reguła,N
"Uważam, że powołanie kogoś, kto nie sprawdził się w szpitalu i jako szef spółdzielni mieszkaniowej, może budzić wątpliwości","powołanie kogoś, kto nie sprawdził się w szpitalu i jako szef spółdzielni mieszkaniowej, może budzić wątpliwości","uważać, że_",epistemiczny,present,NF,present,False,indywidualne,N
wydawałoby się oczywiste że wola należy yy yy do zmarłego ale domyślam się że mogą być różne sytuacje kiedy zmarły życzy sobie tak a rodzina mówi nie ślub yyy ślub pogrzeb będzie yyy kościelny ,mogą być różne sytuacje ,"domyślam(y) się, że_",epistemiczny,present,NF,present,False,indywidualne,N
" Gdy ktoś jest zadowolony ze swego życia, wiedzie mu się nieźle, ale chciałby sobie polepszyć kupując tzw. remedia Feng Shui, ustawiając gdzie się da (bo modne), nagle dziwi się, że skutek jest odwrotny od zamierzonego.", skutek jest odwrotny od zamierzonego.,"dziwić się, że_",epistemiczny,present,F,present,False,reguła,E
"Śmiali się w nos, gdym wszczął gwałt i upierałem się w Home Office, że jeżeli chcą być logicznymi, muszą mnie uważać za Niemca.","jeżeli chcą być logicznymi, muszą mnie uważać za Niemca.","upierać się, że_",mówienia,past,NF,inne,False,indywidualne,N
" Czuję, że już mnie nie kochasz. ",już mnie nie kochasz. ,"[e] czuć, że_",epistemiczny,present,NF,present,False,indywidualne,N
" Przede wszystkim, zasadniczo religijny sposób myślenia i odczuwania każe jej, w znacznie większej mierze niż to czyni Różewicz, operować paradoksem - a obecność paradoksu sprawia, że wiersz staje się nie samym tylko nagim zapisem doświadczenia lecz intelektualną konstrukcją. ", wiersz staje się nie samym tylko nagim zapisem doświadczenia lecz intelektualną konstrukcją. ,"sprawiać, że_",inne,present,NF,present,False,indywidualne,E
mówienie o czymś takim że u nas jest homofobia to jest po prostu niesprawiedliwe ,u nas jest homofobia ,"mówić, że_",mówienia,,NF,present,False,indywidualne,N
"Po prostu, powiedz mu, że ma się odczepić. ",ma się odczepić. ,"powiedzieć, że_",mówienia,,NF,present,False,imperatyw,N
"Rok temu pisaliśmy, że demokracja nie uznaje żadnych świętości i że pani prezydentowa, wzywana wówczas przez komisję orlenowską o ujawnienie finansów swojej fundacji, musi publicznej takiej lustracji się poddać. "," pani prezydentowa, wzywana wówczas przez komisję orlenowską o ujawnienie finansów swojej fundacji, musi publicznej takiej lustracji się poddać. ","pisać, że_",mówienia,past,NF,present,False,indywidualne,N
"Myślałam, że przynajmniej z panem sobie porozmawiam. ",przynajmniej z panem sobie porozmawiam. ,"myśleć, że_",epistemiczny,past,NF,future,False,indywidualne,C
wydaje mi się że dla PiS-u szczególnie istotny jest wynik a nawet nie tyle wynik procentowy. co to ilu będzie ta partia miała radnych starostów burmistrzów ,dla PiS-u szczególnie istotny jest wynik,"wydaje się komuś, że_",epistemiczny,present,NF,present,False,indywidualne,N
"Może ty myślisz, że jednym ludziom Pan Bóg daje serca, a drugim kamienie"," jednym ludziom Pan Bóg daje serca, a drugim kamienie","myśleć, że_",epistemiczny,present,NF,present,False,indywidualne,N
myślę że na tego typu osiedlu będą mieszkali ludzie którzy po prostu dobrze wykonują swoje obowiązki tak bym powiedział i nie specjalnie przejmują się otoczeniem w którym śpią poza tym że chcą też być sami,na tego typu osiedlu będą mieszkali ludzie którzy po prostu dobrze wykonują swoje obowiązki ,"myśleć, że_",epistemiczny,present,NF,future,False,indywidualne,N
"Wobec wyników głosowania stwierdzam, że Senat podjął uchwałę w sprawie ustawy o świadczeniach pieniężnych z ubezpieczenia społecznego w razie choroby i macierzyństwa.",Senat podjął uchwałę w sprawie ustawy o świadczeniach pieniężnych z ubezpieczenia społecznego w razie choroby i macierzyństwa.,"stwierdzać, że_",mówienia,present,NF,past,False,performatyw,N
"Aby paradoksom nie było końca, wypada zauważyć, że obecnie okrawa się MSWiA, a wzmacnia nowymi urzędami premiera, którym - jak wiele wskazuje - będzie Leszek Miller. ","obecnie okrawa się MSWiA, a wzmacnia nowymi urzędami premiera","[e] zauważyć, że_",epistemiczny,,F,present,False,indywidualne,E
" I... dzięki niemu zrozumiałam, że... jednak warto dalej żyć...",jednak warto dalej żyć...,"zrozumieć, że_",epistemiczny,past,F,inne,False,indywidualne,E
"Pewną wadą zmiennych jest konieczność ich deklarowania, tj. informowania kompilatora, że dana zmienna jest określonego typu.", dana zmienna jest określonego typu.,"informować, że_",mówienia,present,NF,present,False,indywidualne,N
